score,input_string,translated_string,translated_CER,translated_WER,target_CER,target_CER_sum,target_WER,unique_id's,speaker_id's,length_deviation_words,audio_name,audio_path,trans_CER,trans_WER
[3 3 5 3 4 5 4 5 3 1],hjørne skinke ødelagt sky blå bart glør korn gul frukt,svar nåklig bra her stjærne jus frå hys rind flag gardner,,,"[0.75, 0.8, 0.8571428571428571, 0.5, 0.6666666666666666, 1.0, 1.0, 1.0, 0.6666666666666666, 0.2]",7.440476190476192,1.0,"['a09', 'd07', 'd06', 'a31', 'a10', 'd11', 'a12', 'a01', 'a13', 'a06']","['a10', 'a13', 'd11', 'a12', 'd06', 'd07', 'a09', 'a06', 'a31', 'a01']",1,words_890_900.wav,../3x10_Concatenations/3x10_no_group_mixed,0.8703703703703703,1.1
[5 5 5 5 5 4 5 5 3 4],tynn internett gris søle søt tårn hjerne ski by stjerne,spott trik krok sturd shit hol krok blåster bien sødde,,,"[1.0, 1.0, 1.0, 1.0, 1.0, 0.6666666666666666, 1.0, 1.0, 0.5, 1.0]",9.166666666666666,1.0,"['d19', 'a30', 'd16', 'd04', 'a02', 'a16', 'a22', 'a25', 'd13']","['a30', 'a16', 'a16', 'd13', 'd16', 'd19', 'd04', 'a02', 'a22', 'a25']",0,words_900_910.wav,../3x10_Concatenations/3x10_no_group_mixed,"[1.25, 0.7777777777777778, 0.75, 1.0, 0.6666666666666666, 1.0, 0.8333333333333334, 2.0, 1.5, 0.7142857142857143]",1.0
[4 5 1 4 5 3 5 5 5 3],sulte vindu tjern koffert internett bro krakk horn fortid ugle,blå! det er låk her la kjøt sølgelig dølgelig gætter at det sølgelig,,,"[1.0, 1.0, 0.0, 0.8, 1.0, 0.6666666666666666, 1.0, 1.0, 1.0, 0.5]",7.966666666666667,0.9,"['a20', 'd04', 'd17', 'a18', 'a13', 'a33']","['a20', 'a18', 'a13', 'a33', 'd17', 'a13', 'd04', 'd17', 'd04', 'a13']",3,words_910_920.wav,../3x10_Concatenations/3x10_no_group_mixed,0.9032258064516129,1.3
[4 4 3 3 3 3 4 3 4 4],børste børste vær pute erter glorie frakk pære mus kart,kva? briter va frøst gil sjern lul perta ius ej og ny,,,"[0.8, 0.8, 0.3333333333333333, 0.75, 0.5, 0.8333333333333334, 0.75, 0.5, 1.0, 0.6666666666666666]",6.9333333333333345,1.0,"['a02', 'a34', 'a29', 'a16', 'd11', 'a25', 'a26', 'a13']","['a16', 'a02', 'a29', 'a13', 'a26', 'd11', 'a25', 'a34', 'a26', 'a26']",2,words_920_930.wav,../3x10_Concatenations/3x10_no_group_mixed,0.7454545454545455,1.2
[3 4 2 3 2 4 5 3 5 5],korn tralle flagg glass bjørn svømme hylle fortid fugl blå,dø jan jan jan litt da trekk lutsch kruss frag blå flir,,,"[0.6666666666666666, 0.8, 0.5, 0.75, 0.25, 1.0, 1.0, 0.8, 1.0, 1.0]",7.766666666666667,1.0,"['a20', 'a09', 'a02', 'a32', 'd10', 'd07', 'a10', 'a12', 'a26', 'a33']","['a20', 'a10', 'a09', 'a26', 'a12', 'a33', 'a32', 'a02', 'd07', 'd10']",2,words_930_940.wav,../3x10_Concatenations/3x10_no_group_mixed,0.8103448275862069,1.1
