score,input_string,translated_string,translated_CER,translated_WER,target_CER,target_CER_sum,target_WER,unique_id's,speaker_id's,length_deviation_words,audio_name,audio_path,trans_CER,trans_WER
1,øre sjakk rød planke ødelagt glorie krakk blå grave svart,det er jo noen det er jo noen det er jo noen det er jo noen,,,"[0.3333333333333333, 0.0, 0.0, 0.3333333333333333, 0.42857142857142855, 0.5, 0.5, 0.3333333333333333, 0.6, 0.0]",3.0285714285714285,0.7,"['d19', 'd16', 'd17', 'd11', 'd13', 'd09']","['d19', 'd19', 'd19', 'd17', 'd17', 'd16', 'd13', 'd11', 'd09', 'd09']",6,words_0_10.wav,../3x10_Concatenations/3x10_score_1_sorted,0.8771929824561403,1.6
1,korn tjern skulder skjørt støvel pluss sjø grønn horn ugle,upp sjeg hjeg hjeg hjeg hjeg hjeg hjeg hjeg hjeg hjeg hjeg hjeg hjeg hjeg hjeg hjeg hjeg hjeg hjeg hjeg hjeg hjeg hjeg hjeg hjeg hjeg hjeg hjeg hjeg hjeg hjeg hjeg hjeg hjeg hjeg hjeg hjeg hjeg hjeg hjeg hjeg hjeg hjeg hjeg hjeg hjeg hjeg hjeg hjeg hjeg hjeg hjeg hjeg hjeg hjeg hjeg hjeg hjeg hjeg hjeg hjeg hjeg hjeg hjeg hjeg hjeg hjeg hjeg hjeg hjeg hjeg hjeg hjeg hjeg hjeg hjeg hjeg hjeg hjeg hjeg hjeg hjeg hjeg hjeg hjeg hjeg hjeg hjeg hjeg hjeg hjeg hjeg hjeg hjeg hjeg hjeg hjeg hjeg hjeg hjeg hjeg hjeg hjeg hjeg hjeg hjeg hjeg hjeg hjeg hjeg h,,,"[0.3333333333333333, 0.0, 0.0, 0.0, 0.16666666666666666, 0.0, 0.0, 0.25, 0.0, 0.0]",0.75,0.3,"['a30', 'd07', 'd08', 'a34']","['d08', 'd08', 'd08', 'd08', 'd08', 'd08', 'd08', 'd07', 'a34', 'a30']",102,words_10_20.wav,../3x10_Concatenations/3x10_score_1_sorted,9.241379310344827,11.2
2,glorie klo kjerne hylle fregner brun bryter flakse drue krakk,blåle blåle pren heller plain blåle blåle blåle blåle blåle,,,"[0.6666666666666666, 0.3333333333333333, 0.25, 0.5, 0.5, 0.5, 0.6666666666666666, 0.6666666666666666, 0.5, 0.5]",5.083333333333333,1.0,['d19'],"['d19', 'd19', 'd19', 'd19', 'd19', 'd19', 'd19', 'd19', 'd19', 'd19']",0,words_0_10.wav,../3x10_Concatenations/3x10_score_2_sorted,"[0.6666666666666666, 1.3333333333333333, 0.6666666666666666, 0.4, 0.8571428571428571, 1.0, 0.6666666666666666, 0.6666666666666666, 1.0, 1.0]",1.0
2,skive søppel skøyter trapp skitten løve premie krykke grå søster,fjølkje fjølkje fjølkje fjølkje fjølkje fjølkje fjølkje fjølkje fjølkje fjølkje fjølkje,,,"[0.5, 0.4, 0.6, 0.5, 0.5, 0.25, 0.6666666666666666, 0.4, 0.3333333333333333, 0.6666666666666666]",4.816666666666666,1.0,"['d19', 'd17', 'd16']","['d19', 'd19', 'd19', 'd19', 'd19', 'd19', 'd19', 'd17', 'd16', 'd16']",1,words_10_20.wav,../3x10_Concatenations/3x10_score_2_sorted,1.046875,1.1
2,plystre kvern glorie klem bryter briller drue barn start løve,pristre kva? klo kram bt bl dv bl dv bl dv bl dv dv dv dv dv dv dv dv dv dv dv dv dv dv dv dv dv dv dv dv dv dv dv dv dv dv dv dv dv dv dv dv dv dv dv dv dv dv dv dv dv dv dv dv dv dv dv dv dv dv dv dv dv dv dv dv dv dv dv dv dv dv dv dv dv dv dv dv dv dv dv dv dv dv dv dv dv dv dv dv dv dv dv dv dv dv dv dv dv dv dv dv dv dv dv dv dv dv dv dv,,,"[0.7142857142857143, 0.5, 0.3333333333333333, 0.5, 0.6666666666666666, 0.6666666666666666, 0.25, 0.3333333333333333, 0.5, 0.5]",4.9642857142857135,1.0,"['d15', 'd14', 'd13', 'd16']","['d16', 'd15', 'd14', 'd14', 'd14', 'd14', 'd14', 'd13', 'd13', 'd13']",102,words_20_30.wav,../3x10_Concatenations/3x10_score_2_sorted,5.278688524590164,11.2
2,plystre blokk horn søle svømme svart glorie garn blomst blå,priste doki um sjell sjell sjell sjell sjell gjell gjell gjell gjell gjell gjell gjell gjell gjell gjell gjell gjell gjell gjell gjell gjell gjell gjell gjell gjell gjell gjell gjell gjell gjell gjell gjell gjell gjell gjell gjell gjell gjell gjell gjell gjell gjell gjell gjell gjell gjell gjell gjell gjell gjell gjell gjell gjell gjell gjell gjell gjell gjell gjell gjell gjell gjell gjell gjell gjell gjell gjell gjell gjell gjell gjell gjell gjell gjell gjell gjell gjell gjell gjell gjell gjell gjell gjell gjell gjell gjell gjell gjell gjell gjell gjell gjell gjell gjell gjell gjell gjell gjell gjell gjell gjell gjell gjell gjell gjell gjell gjell gjell gjell,,,"[0.42857142857142855, 0.25, 0.3333333333333333, 0.5, 0.6, 0.5, 0.6666666666666666, 0.3333333333333333, 0.6666666666666666, 0.3333333333333333]",4.6119047619047615,1.0,"['d10', 'd11', 'd12', 'd09']","['d12', 'd11', 'd10', 'd10', 'd10', 'd10', 'd09', 'd09', 'd09', 'd09']",102,words_30_40.wav,../3x10_Concatenations/3x10_score_2_sorted,10.915254237288135,11.2
2,bjørn artist søt terning løve horn glorie glad kikkert børste,jeg fikk det som laksen hva er det?,,,"[0.5, 0.6, 0.3333333333333333, 0.6, 0.5, 0.3333333333333333, 0.6666666666666666, 0.3333333333333333, 0.6, 0.4]",4.866666666666666,1.0,"['d08', 'd09']","['d09', 'd09', 'd09', 'd09', 'd09', 'd08', 'd08', 'd08', 'd08', 'd08']",-2,words_40_50.wav,../3x10_Concatenations/3x10_score_2_sorted,0.7377049180327869,1.0
2,barn flette drue skjema smart vindu tralle munn glorie horn,og,,,"[0.3333333333333333, 0.6, 0.5, 0.0, 0.25, 0.6, 0.6, 0.3333333333333333, 0.5, 0.3333333333333333]",4.05,0.9,"['d07', 'd08', 'd06']","['d08', 'd08', 'd08', 'd08', 'd08', 'd08', 'd08', 'd08', 'd07', 'd06']",-9,words_50_60.wav,../3x10_Concatenations/3x10_score_2_sorted,0.9830508474576272,1.0
2,ugle kurv drikke søle svømme rød artist hjørne hjort glis,i går det kjedef plakke søre sømmer har du? det er at det st i anne ut ut ut ut,,,"[0.25, 0.0, 0.4, 0.5, 0.4, 0.0, 0.4, 0.5, 0.0, 0.5]",2.95,0.7,"['d02', 'a34', 'd06', 'd01']","['d06', 'd06', 'd02', 'd02', 'd02', 'd02', 'd01', 'a34', 'a34', 'a34']",10,words_60_70.wav,../3x10_Concatenations/3x10_score_2_sorted,0.8421052631578947,2.0
2,kort korn klo klem kikkert blokk bart fortid fortau fort,gått gått gått gått gått kram sikket bryk batt førtet førtet førtet føtt,,,"[0.3333333333333333, 0.3333333333333333, 0.3333333333333333, 0.25, 0.6, 0.5, 0.3333333333333333, 0.4, 0.25, 0.3333333333333333]",3.666666666666667,1.0,['a34'],"['a34', 'a34', 'a34', 'a34', 'a34', 'a34', 'a34', 'a34', 'a34', 'a34']",3,words_70_80.wav,../3x10_Concatenations/3x10_score_2_sorted,0.7678571428571429,1.3
3,frakk hjerne grønn grave grå glitter frø hjerte hjørne hus,"flak, ljern glam glam glom blitt hjel flak i atte jo no",,,"[0.75, 0.75, 0.75, 0.8, 0.3333333333333333, 0.8333333333333334, 0.6666666666666666, 0.75, 0.75, 0.6666666666666666]",7.05,1.0,['d19'],"['d19', 'd19', 'd19', 'd19', 'd19', 'd19', 'd19', 'd19', 'd19', 'd19']",2,words_0_10.wav,../3x10_Concatenations/3x10_score_3_sorted,0.5862068965517241,1.2
3,krabbe fortau bror brød bro barn artist ekorn fort flaske,plag for alt blod blod blod blod og det er ikke det er ikke for flast her,,,"[0.6, 0.75, 0.5, 0.3333333333333333, 0.6666666666666666, 0.6666666666666666, 0.6, 0.75, 0.6666666666666666, 0.8333333333333334]",6.366666666666667,1.0,['d19'],"['d19', 'd19', 'd19', 'd19', 'd19', 'd19', 'd19', 'd19', 'd19', 'd19']",7,words_10_20.wav,../3x10_Concatenations/3x10_score_3_sorted,0.7543859649122807,1.7
3,fjorten by drops drikke søster sølv snørr smart sky skjerm,"vi har å bli loppse glittet hes seg siste, siste, siste, snal, smart, frik, fjell,",,,"[0.6, 0.5, 0.6, 0.8, 0.8333333333333334, 0.6666666666666666, 0.75, 0.75, 0.5, 0.5]",6.5,1.0,['d19'],"['d19', 'd19', 'd19', 'd19', 'd19', 'd19', 'd19', 'd19', 'd19', 'd19']",5,words_20_30.wav,../3x10_Concatenations/3x10_score_3_sorted,0.9310344827586207,1.5
3,skjerf skjema svart kran turn trylle troll tre tralle skjære,halt! hva? gland! gland! gland! gland! gland! gland!,,,"[0.75, 0.75, 0.75, 0.75, 0.6666666666666666, 0.6, 0.75, 0.6666666666666666, 0.8, 0.75]",7.233333333333333,1.0,['d19'],"['d19', 'd19', 'd19', 'd19', 'd19', 'd19', 'd19', 'd19', 'd19', 'd19']",-2,words_30_40.wav,../3x10_Concatenations/3x10_score_3_sorted,0.8166666666666667,1.0
3,mus løpe kurv skip kropp skilpadde sjiraff pluss plaster hjerne,når vikører påkører påklopsyll på måsyll på måsyll påbløspostetjærne,,,"[0.6666666666666666, 0.75, 0.75, 0.6666666666666666, 0.75, 0.8571428571428571, 0.8, 0.75, 0.8571428571428571, 0.75]",7.597619047619047,1.0,"['d19', 'd18']","['d19', 'd19', 'd19', 'd19', 'd19', 'd19', 'd19', 'd19', 'd19', 'd18']",-1,words_40_50.wav,../3x10_Concatenations/3x10_score_3_sorted,0.7936507936507936,1.0
3,garn horn hus barn fortau drikke sky skjerf kvart skjære,gårn hvor? hvor? hvor? hvor? hvor? hvor? hvor? hvor?,,,"[0.6666666666666666, 0.6666666666666666, 0.6666666666666666, 0.6666666666666666, 0.75, 0.6, 0.5, 0.75, 0.75, 0.75]",6.766666666666667,1.0,['d18'],"['d18', 'd18', 'd18', 'd18', 'd18', 'd18', 'd18', 'd18', 'd18', 'd18']",-1,words_50_60.wav,../3x10_Concatenations/3x10_score_3_sorted,0.6607142857142857,1.0
3,pluss prins hjørne drue sky svart svømme ugle kvern sjakk,bløsig brings pjånne hæ geru deg hæ sva sva med kla tva en sva,,,"[0.75, 0.8, 0.75, 0.5, 0.5, 0.75, 0.8, 0.75, 0.75, 0.6666666666666666]",7.016666666666667,1.0,"['d18', 'd17']","['d18', 'd18', 'd17', 'd17', 'd17', 'd17', 'd17', 'd17', 'd17', 'd17']",4,words_60_70.wav,../3x10_Concatenations/3x10_score_3_sorted,0.6140350877192983,1.4
3,horn grønn glass karneval jus enhjørning dyne dykke drue sky,un grann klaft karnval ryus en annen inn din du ikke du røver,,,"[0.6666666666666666, 0.75, 0.5, 0.8571428571428571, 0.6666666666666666, 0.7142857142857143, 0.5, 0.75, 0.5, 0.0]",5.904761904761905,0.9,['d16'],"['d16', 'd16', 'd16', 'd16', 'd16', 'd16', 'd16', 'd16', 'd16', 'd16']",3,words_70_80.wav,../3x10_Concatenations/3x10_score_3_sorted,0.48333333333333334,1.3
3,svømme skjerf lys kurv plaster skjære skive sjakk prins hjørne,så vemmet kjørif litt gør dottet sjære jjør jjør prin jørene,,,"[0.8, 0.5, 0.3333333333333333, 0.75, 0.8571428571428571, 0.75, 0.75, 0.3333333333333333, 0.8, 0.75]",6.623809523809524,1.0,"['d15', 'd16']","['d16', 'd16', 'd16', 'd16', 'd16', 'd16', 'd16', 'd16', 'd16', 'd15']",1,words_80_90.wav,../3x10_Concatenations/3x10_score_3_sorted,0.5,1.1
3,horn korn fortau flagg drue smør skjorte turn grave grønn,hvorfor ten slange? det er du det smell stortet tudet gjerne gjerne,,,"[0.6666666666666666, 0.6666666666666666, 0.75, 0.5, 0.75, 0.75, 0.75, 0.6666666666666666, 0.6, 0.5]",6.6,1.0,"['d15', 'd14']","['d15', 'd15', 'd15', 'd15', 'd15', 'd15', 'd15', 'd15', 'd14', 'd14']",2,words_90_100.wav,../3x10_Concatenations/3x10_score_3_sorted,0.7017543859649122,1.2
3,gris glør glitter glass hus frø krakk fregner brun bror,gis gudet deg gudet deg dette dette dette dette dette dette dette dette dette dette dette dette dette dette dette dette dette dette dette dette dette dette dette dette dette dette dette dette dette dette dette dette dette dette dette dette dette dette dette dette dette dette dette dette dette dette dette dette dette dette dette dette dette dette dette dette dette dette dette dette dette dette dette dette dette dette dette dette dette dette dette dette dette dette dette dette dette dette dette dette dette dette dette dette dette dette dette dette dette dette dette dette dette dette dette dette dette dette dette dette dette dette dette dette dette dette dette dette dette dette dette dette dette dette dette dette dette dette dette dette dette dette dette dette dette dette dette dette dette dette dette dette dette dette dette dette dette dette dette dette dette dette dette dette,,,"[0.75, 0.75, 0.6666666666666666, 0.75, 0.6666666666666666, 0.3333333333333333, 0.75, 0.6666666666666666, 0.75, 0.5]",6.583333333333333,1.0,['d14'],"['d14', 'd14', 'd14', 'd14', 'd14', 'd14', 'd14', 'd14', 'd14', 'd14']",139,words_100_110.wav,../3x10_Concatenations/3x10_score_3_sorted,15.8,14.9
3,bro blomst bart frakk drops kran krone søster smør skulder,det er jo prømst fjok djup fjong jonga sistig snøj skulelej,,,"[0.6666666666666666, 0.8333333333333334, 0.6666666666666666, 0.75, 0.8, 0.75, 0.8, 0.8333333333333334, 0.75, 0.7142857142857143]",7.564285714285714,1.0,['d14'],"['d14', 'd14', 'd14', 'd14', 'd14', 'd14', 'd14', 'd14', 'd14', 'd14']",1,words_110_120.wav,../3x10_Concatenations/3x10_score_3_sorted,0.6206896551724138,1.1
3,ugle trylle troll tre trapp tralle kropp skjerf plaster øre,uttere tiene tjon tja tja tjon tja tja tja da sjjjjjjjjjjjjjjjjjjjjjjjjjjjjjjjjjjjjjjjjjjjjjjjjjjjjjjjjjjjjjjjjjjjjjjjjjjjjjjjjjjjjjjjjjjjjjjjjjjjjjjjjjjjjjjjjjjjjjjjjjjjjjjjjjjjjjjjjjjjjjjjjjjjjjjjjjjjjjjjjjjjjjjjjjjjjjjjjjjjjjjjjjjjjjjjjjjjjjjjjjjjjjjjjjjjjjjjjjjjjjjjjjjjjjjjjjjjjjjjjjjjjjjjjjjjjjjjjjjjjjjjjjjjjjjjjjjjjjjjjjjjjjjjjjjjjjjjjjjjjjjjjjjjjjjjjjjjjjjjjjjjjjjjjjjjjjjjjjjjjjjjjjjjjjjjjjjjjjjjjjjjjjjjjjjjjjjjjjjjjjjjjjjjjjjjjjjjjjjjjjjjjjjjjjjjjj,,,"[0.5, 0.8, 0.75, 0.6666666666666666, 0.5, 0.6, 0.75, 0.75, 0.7142857142857143, 0.6666666666666666]",6.697619047619048,1.0,['d14'],"['d14', 'd14', 'd14', 'd14', 'd14', 'd14', 'd14', 'd14', 'd14', 'd14']",1,words_120_130.wav,../3x10_Concatenations/3x10_score_3_sorted,7.491525423728813,1.1
3,lys kurv lytte plystre sjiraff skjære rund rød prins hus,"lise, kjø, litte, pristig, svilt, seg gjør, gjør, gjør, gjør, gjør,",,,"[0.3333333333333333, 0.75, 0.75, 0.7142857142857143, 0.8, 0.75, 0.6666666666666666, 0.5, 0.8, 0.6666666666666666]",6.730952380952381,1.0,"['d14', 'd13']","['d14', 'd14', 'd14', 'd14', 'd14', 'd14', 'd14', 'd14', 'd14', 'd13']",1,words_130_140.wav,../3x10_Concatenations/3x10_score_3_sorted,0.7678571428571429,1.1
3,kjerne huske by børste drops søster sky kropp ugle turn,sal priske bier tastet røps røps røps røps skjer kjer kjer i kjøs i kjøs,,,"[0.5, 0.8, 0.5, 0.8, 0.8, 0.8333333333333334, 0.5, 0.75, 0.75, 0.6666666666666666]",6.9,1.0,['d13'],"['d13', 'd13', 'd13', 'd13', 'd13', 'd13', 'd13', 'd13', 'd13', 'd13']",5,words_140_150.wav,../3x10_Concatenations/3x10_score_3_sorted,0.9272727272727272,1.5
3,syk kurv rød grå glorie horn koffert kikkert bror drue,seg kredet kredet kredet kredet kredet kredet kredet kredet kredet kredet kredet kredet kredet kredet kredet kredet kredet kredet kredet kredet kredet kredet kredet kredet kredet kredet kredet kredet kredet kredet kredet kredet kredet kredet kredet kredet kredet kredet kredet kredet kredet kredet kredet kredet kredet kredet kredet kredet kredet kredet kredet kredet kredet kredet kredet kredet kredet kredet kredet kredet kredet kredet kredet kredet kredet kredet kredet kredet kredet kredet kredet kredet kredet kredet kredet kredet kredet kredet kredet kredet kredet kredet kredet kredet kredet kredet kredet kredet kredet kredet kredet kredet kredet kredet kredet kredet kredet kredet kredet kredet kredet kredet kredet kredet kredet kredet kredet kredet kredet kredet kredet kredet kredet kredet kredet kredet kredet kredet kredet kredet kredet kredet kredet kredet kredet kredet kredet kredet kredet kredet kredet kredet kredet kredet kredet kredet kredet kredet kredet kredet kredet kredet kredet kredet kredet kredet kredet kred,,,"[0.6666666666666666, 0.5, 0.5, 0.6666666666666666, 0.6666666666666666, 0.6666666666666666, 0.6, 0.8, 0.75, 0.75]",6.566666666666666,1.0,"['d12', 'd13']","['d13', 'd13', 'd13', 'd12', 'd12', 'd12', 'd12', 'd12', 'd12', 'd12']",139,words_150_160.wav,../3x10_Concatenations/3x10_score_3_sorted,18.574074074074073,14.9
3,søster trapp løve kvart skjære rød premie port hjørne frukt,søstig frapp løver kvart sade rø pive i hjemme fukt bjerne fikt,,,"[0.8333333333333334, 0.75, 0.75, 0.75, 0.5, 0.0, 0.8333333333333334, 0.6666666666666666, 0.75, 0.8]",6.633333333333334,0.9,"['d11', 'd12']","['d12', 'd12', 'd12', 'd12', 'd12', 'd12', 'd12', 'd12', 'd11', 'd11']",2,words_160_170.wav,../3x10_Concatenations/3x10_score_3_sorted,0.423728813559322,1.1
3,glorie glør horn hund bror blad fortau stjerne start sky,"i løbret gløver kund, jøbret, platt, fort av stjern, størt, skj",,,"[0.8333333333333334, 0.75, 0.6666666666666666, 0.6666666666666666, 0.5, 0.5, 0.5, 0.8333333333333334, 0.75, 0.5]",6.5,1.0,['d11'],"['d11', 'd11', 'd11', 'd11', 'd11', 'd11', 'd11', 'd11', 'd11', 'd11']",1,words_170_180.wav,../3x10_Concatenations/3x10_score_3_sorted,0.5,1.1
3,svart turn trapp mus lytte lyn kvern ku port gul,såd tid drop nys lysk lysk lid i hjem kvann kj kjøl,,,"[0.75, 0.6666666666666666, 0.5, 0.6666666666666666, 0.75, 0.3333333333333333, 0.75, 0.5, 0.6666666666666666, 0.6666666666666666]",6.25,1.0,"['d10', 'd11']","['d11', 'd11', 'd11', 'd11', 'd11', 'd11', 'd11', 'd11', 'd11', 'd10']",2,words_180_190.wav,../3x10_Concatenations/3x10_score_3_sorted,0.7708333333333334,1.2
3,gris glør kran kort huske kikkert artist blad by erter,jeg gør ikke gør ikke gør ikke du sker ikke jeg er det ikke bra ut du blir jeg er det ikke,,,"[0.5, 0.75, 0.75, 0.6666666666666666, 0.8, 0.6, 0.8, 0.5, 0.0, 0.75]",6.116666666666667,0.9,['d10'],"['d10', 'd10', 'd10', 'd10', 'd10', 'd10', 'd10', 'd10', 'd10', 'd10']",12,words_190_200.wav,../3x10_Concatenations/3x10_score_3_sorted,1.0740740740740742,2.2
3,stjerne smykke mus kvart kurv kropp skitten skip glad glør,serne smikke nys kvart kvart krop sjettet sjip og kval,,,"[0.8333333333333334, 0.8, 0.6666666666666666, 0.5, 0.5, 0.75, 0.75, 0.6666666666666666, 0.6666666666666666, 0.75]",6.883333333333334,1.0,"['d10', 'd09']","['d10', 'd10', 'd10', 'd10', 'd10', 'd10', 'd10', 'd10', 'd09', 'd09']",0,words_200_210.wav,../3x10_Concatenations/3x10_score_3_sorted,"[0.2857142857142857, 0.16666666666666666, 0.6666666666666666, 0.0, 0.75, 0.2, 0.42857142857142855, 0.25, 1.0, 1.0]",0.9
3,grå krabbe kort klem kikkert jern fjorten briller bart krykke,grød hva er det? jeg er jeg er jeg er jeg er jeg er jeg er jeg er jeg er jeg er jeg er jeg er jeg er jeg er jeg er jeg er jeg er jeg er jeg er jeg er jeg er jeg er jeg er jeg er jeg er jeg er jeg er jeg er jeg er jeg er jeg er jeg er jeg er jeg er jeg er jeg er jeg er jeg er jeg er jeg er jeg er jeg er jeg er jeg er jeg er jeg er jeg er jeg er jeg er jeg er jeg er jeg er jeg er jeg er jeg er jeg er jeg er jeg er jeg er jeg er jeg er jeg er jeg er jeg er jeg er jeg er jeg er jeg er jeg er jeg er jeg er jeg er jeg er jeg er jeg er jeg er jeg er jeg er jeg er jeg er jeg er jeg er jeg er jeg er jeg er jeg er jeg er jeg er jeg er jeg er jeg er jeg er jeg er jeg er jeg er jeg er jeg er jeg er jeg er jeg er jeg er jeg er jeg er jeg er jeg er jeg er jeg er jeg er jeg er jeg er jeg er jeg er jeg er jeg er jeg er jeg er jeg er jeg er jeg er jeg er jeg er jeg er jeg er jeg er jeg er jeg er jeg er jeg er jeg er jeg er jeg er jeg er jeg er jeg er jeg er jeg er jeg er jeg er jeg er jeg er jeg er jeg er jeg er jeg er jeg er jeg er,,,"[0.6666666666666666, 0.6, 0.6666666666666666, 0.75, 0.8, 0.6666666666666666, 0.8, 0.6666666666666666, 0.6666666666666666, 0.8]",7.083333333333334,1.0,['d09'],"['d09', 'd09', 'd09', 'd09', 'd09', 'd09', 'd09', 'd09', 'd09', 'd09']",284,words_210_220.wav,../3x10_Concatenations/3x10_score_3_sorted,16.42622950819672,29.4
3,brun flagg flue enhjørning sølv sport søle smart skjorte kvern,rien,,,"[0.75, 0.75, 0.75, 0.8571428571428571, 0.6666666666666666, 0.75, 0.25, 0.5, 0.75, 0.75]",6.773809523809524,1.0,['d09'],"['d09', 'd09', 'd09', 'd09', 'd09', 'd09', 'd09', 'd09', 'd09', 'd09']",-9,words_220_230.wav,../3x10_Concatenations/3x10_score_3_sorted,0.9354838709677419,1.0
3,tralle tårn plaster ørn skitten skip gutt garn hjerte gris,det er en lød det er en lød det er en lød det er en lød det er en lød det er en lød det er en lød det er en lød det er en lød det er en lød det er en lød det er en lød det er en lød det er en lød det er en lød det er en lød det er en lød det er en lød det er en lød det er en lød det er en lød det er en lød det er en lød det er en lød det er en lød det er en lød det er en lød det er en lød det er en lød det er en lød det er en lød det er en lød det er en lød det er en lød det er en lød det er en lød det er en lød det er en lød det er en lød det er en lød det er en lød det er en lød det er en lød det er en lød det er en lød det er en lød det er en lød det er en lød det er en lød det er en lød det er en lød det er en lød det er en lød det er en lød det er en lød det er en lød det er en lød det er en lød det er en lød det er en lød det er en lød det er en lød det er en lød det er en,,,"[0.8, 0.6666666666666666, 0.8571428571428571, 0.5, 0.75, 0.6666666666666666, 0.6666666666666666, 0.6666666666666666, 0.5, 0.75]",6.823809523809524,1.0,"['d08', 'd09']","['d09', 'd09', 'd09', 'd09', 'd09', 'd09', 'd08', 'd08', 'd08', 'd08']",245,words_230_240.wav,../3x10_Concatenations/3x10_score_3_sorted,14.724137931034482,25.5
3,grønn glør koffert huske klappe krabbe klem jus buss brun,nå! nå! nå! nå! nå! nå! nå! nå! nå! nå! nå! nå! nå! nå!,,,"[0.5, 0.75, 0.8, 0.8, 0.8, 0.8, 0.75, 0.6666666666666666, 0.3333333333333333, 0.75]",6.95,1.0,['d08'],"['d08', 'd08', 'd08', 'd08', 'd08', 'd08', 'd08', 'd08', 'd08', 'd08']",4,words_240_250.wav,../3x10_Concatenations/3x10_score_3_sorted,0.8947368421052632,1.4
3,blomst bleie frakk fortid fortau enhjørning dyne krakk krone start,bra! bra! bra! bra! bra! bra! bra! bra! bra! bra! bra! bra! bra! bra! bra! bra! bra! bra! bra! bra! bra! bra! bra! bra! bra! bra! bra! bra! bra! bra! bra! bra! bra! bra! bra! bra! bra! bra! bra! bra! bra! bra! bra! bra! bra! bra! bra! bra! bra! bra! bra! bra! bra! bra! bra! bra! bra! bra! bra! bra! bra! bra! bra! bra! bra! bra! bra! bra! bra! bra! bra! bra! bra! bra! bra! bra! bra! bra! bra! bra! bra! bra! bra! bra! bra! bra! bra! bra! bra! bra! bra! bra! bra! bra! bra! bra! bra! bra! bra! bra! bra! bra! bra! bra! bra! bra! bra! bra! bra! bra! bra! bra! bra! bra! bra! bra! bra! bra! bra! bra! bra! bra! bra! bra! bra! bra! bra! bra! bra! bra! bra! bra! bra! bra! bra! bra! bra! bra! bra! bra! bra! bra! bra! bra! bra! bra! bra! bra! bra! bra! bra! bra! bra! bra! bra! bra! bra! bra! bra! bra! bra! bra! bra! bra! bra! bra! bra! bra! bra! bra! bra! bra! bra! bra! bra! bra! bra! bra! bra! bra! bra! bra! bra! bra! bra! bra! bra! bra! bra! bra! bra! bra! bra! bra! bra! bra! bra! bra! bra! bra! bra! bra! bra! bra! bra! bra! bra! bra! bra! bra! bra! bra! bra! bra! bra! bra! bra! bra! bra! bra! bra! bra!,,,"[0.6666666666666666, 0.75, 0.75, 0.8, 0.75, 0.7142857142857143, 0.75, 0.75, 0.8, 0.75]",7.480952380952381,1.0,['d08'],"['d08', 'd08', 'd08', 'd08', 'd08', 'd08', 'd08', 'd08', 'd08', 'd08']",212,words_250_260.wav,../3x10_Concatenations/3x10_score_3_sorted,16.46969696969697,22.2
3,søt søster sølv smør smerte skjorte stupe ugle turn troll,hva? hva? hva? hva? hva? hva? hva? hva? hva? hva? hva? hva? hva? hva? hva? hva? hva? hva? hva? hva? hva? hva? hva? hva? hva? hva? hva? hva? hva? hva? hva? hva? hva? hva? hva? hva? hva? hva? hva? hva? hva? hva? hva? hva? hva? hva? hva? hva? hva? hva? hva? hva? hva? hva? hva? hva? hva? hva? hva? hva? hva? hva? hva? hva? hva? hva? hva? hva? hva? hva? hva? hva? hva? hva? hva? hva? hva? hva? hva? hva? hva? hva? hva? hva? hva? hva? hva? hva? hva? hva? hva? hva? hva? hva? hva? hva? hva? hva? hva? hva? hva? hva? hva? hva? hva? hva? hva? hva? hva? hva? hva? hva? hva? hva? hva? hva? hva? hva? hva? hva? hva? hva? hva? hva? hva? hva? hva? hva? hva? hva? hva? hva? hva? hva? hva? hva? hva? hva? hva? hva? hva? hva? hva? hva? hva? hva? hva? hva?,,,"[0.6666666666666666, 0.8333333333333334, 0.6666666666666666, 0.75, 0.8, 0.75, 0.8, 0.5, 0.6666666666666666, 0.75]",7.183333333333334,1.0,['d08'],"['d08', 'd08', 'd08', 'd08', 'd08', 'd08', 'd08', 'd08', 'd08', 'd08']",138,words_260_270.wav,../3x10_Concatenations/3x10_score_3_sorted,12.789473684210526,14.8
3,trapp syk ørn øre ødelagt lys lyn kvern krykke plante,vi er enn vi er enn vi er enn vi er enn vi er enn vi er enn vi er enn vi er enn vi er enn vi er enn vi er enn vi er enn vi er enn vi er enn vi er enn vi er enn vi er enn vi er enn vi er enn vi er enn vi er enn vi er enn vi er enn vi er enn vi er enn vi er enn vi er enn vi er enn vi er enn vi er enn vi er enn vi er enn vi er enn vi er enn vi er enn vi er enn vi er enn vi er enn vi er enn vi er enn vi er enn vi er enn vi er enn vi er enn vi er enn vi er enn vi er enn vi er enn vi er enn vi er enn vi er enn vi er enn vi er enn vi er enn vi er enn vi er enn vi er enn vi er enn vi er enn vi er enn vi er enn vi er enn vi er enn vi er enn vi er enn vi er enn vi er enn vi er enn vi er enn vi er enn vi er enn vi er enn vi er enn vi er enn vi er enn vi er enn vi er enn vi er enn vi er enn vi er enn vi er enn vi er enn vi er enn vi er enn vi er enn vi er enn vi er enn vi er enn vi er enn,,,"[0.75, 0.3333333333333333, 0.5, 0.6666666666666666, 0.8571428571428571, 0.6666666666666666, 0.6666666666666666, 0.5, 0.8, 0.8333333333333334]",6.573809523809523,1.0,['d08'],"['d08', 'd08', 'd08', 'd08', 'd08', 'd08', 'd08', 'd08', 'd08', 'd08']",257,words_270_280.wav,../3x10_Concatenations/3x10_score_3_sorted,16.32075471698113,26.7
4,vindu glad garn kikkert klem hund jern huske fortid blad,wind blam blam checket blam wind blam blam,,,"[0.8, 0.6666666666666666, 0.6666666666666666, 0.8, 0.75, 0.6666666666666666, 0.6666666666666666, 0.8, 1.0, 1.0]",7.816666666666666,1.0,['d19'],"['d19', 'd19', 'd19', 'd19', 'd19', 'd19', 'd19', 'd19', 'd19', 'd19']",-2,words_0_10.wav,../3x10_Concatenations/3x10_score_4_sorted,0.625,1.0
4,buss smykke svømme tjern tårn stjerne planke ødelagt krykke ørn,hvis smikke sønmak sønmak søn storn sjælma blankke tøn glatt tittke rann,,,"[0.6666666666666666, 0.8, 1.0, 0.6666666666666666, 0.6666666666666666, 0.8333333333333334, 1.0, 0.7142857142857143, 0.8, 0.5]",7.647619047619048,1.0,['d19'],"['d19', 'd19', 'd19', 'd19', 'd19', 'd19', 'd19', 'd19', 'd19', 'd19']",2,words_10_20.wav,../3x10_Concatenations/3x10_score_4_sorted,0.6031746031746031,1.2
